{
  "schema_version": "2.0",
  "sample_id": "interpretation-manual-p103-p106-round4-holdout",
  "source": {
    "file_name": "ASC-INT-001-ASC-Farm-Standard-Interpretation-Manual-V1.0-May-2025.pdf",
    "sha256": "804ead3d1d1a53019869b5385dabfb86356b8276b990538c0d782e750167777e",
    "language": "en",
    "document_family": "interpretation_manual",
    "page_count": 511
  },
  "sample": {
    "round_id": "goal04-round4",
    "split": "holdout",
    "page_numbers": [
      103,
      104,
      105,
      106
    ],
    "selection_rationale": "Untouched risk window with repeated Indicator/Requirement tables, dense and/or clause logic, multiple explicit numeric thresholds and time windows, a direct footnote exemption, and interpretation/evidence/auditor/resource continuations that must remain outside normative Requirement text."
  },
  "annotation": {
    "status": "frozen",
    "frozen_at": "2026-08-28",
    "verification": [
      "visual_page",
      "native_text"
    ],
    "notes": [
      "Frozen before any parser prediction for this window was inspected.",
      "Requirement text was transcribed from the visible table cells and checked against native text.",
      "Interpretation, evidence examples, auditor guidance and resources are retained as related context or excluded regions, never as normative_text."
    ]
  },
  "segments": [
    {
      "segment_id": "p103-header",
      "page_number": 103,
      "page_index": 102,
      "page_size": {
        "width": 595.32,
        "height": 841.92,
        "unit": "pdf_point",
        "origin": "top_left"
      },
      "bbox": {
        "x0": 394.39,
        "y0": 35.28,
        "x1": 543.37,
        "y1": 44.5
      },
      "role": "header",
      "object_kind": "text_block",
      "segment_order": 0,
      "source_text": "Aquaculture Stewardship Council"
    },
    {
      "segment_id": "p103-table-header",
      "page_number": 103,
      "page_index": 102,
      "page_size": {
        "width": 595.32,
        "height": 841.92,
        "unit": "pdf_point",
        "origin": "top_left"
      },
      "bbox": {
        "x0": 56.78,
        "y0": 90.46,
        "x1": 192.26,
        "y1": 102.6
      },
      "role": "other",
      "object_kind": "table_cell",
      "segment_order": 1,
      "source_text": "Indicator: Requirement:"
    },
    {
      "segment_id": "p103-r2.6.10-id",
      "page_number": 103,
      "page_index": 102,
      "page_size": {
        "width": 595.32,
        "height": 841.92,
        "unit": "pdf_point",
        "origin": "top_left"
      },
      "bbox": {
        "x0": 53.9,
        "y0": 131.15,
        "x1": 93.53,
        "y1": 148.26
      },
      "role": "requirement_id",
      "object_kind": "table_cell",
      "segment_order": 2,
      "source_text": "2.6.10"
    },
    {
      "segment_id": "p103-r2.6.10-normative",
      "page_number": 103,
      "page_index": 102,
      "page_size": {
        "width": 595.32,
        "height": 841.92,
        "unit": "pdf_point",
        "origin": "top_left"
      },
      "bbox": {
        "x0": 117.74,
        "y0": 131.24,
        "x1": 540.5,
        "y1": 286.35
      },
      "role": "normative_text",
      "object_kind": "table_cell",
      "segment_order": 3,
      "source_text": "The UoC shall, after the determination of the water quality baseline, conduct monitoring of the water quality parameters listed below, following the method outlined in Appendix 8 (8.8)13:\nTotal Nitrogen (TN); and,\nTotal Phosphorous (TP); and,\nDissolved Oxygen (DO); and,\nSecchi Disk (SD) depth; and,\nChlorophyll-a (Chl-a)."
    },
    {
      "segment_id": "p103-r2.6.10-interpretation",
      "page_number": 103,
      "page_index": 102,
      "page_size": {
        "width": 595.32,
        "height": 841.92,
        "unit": "pdf_point",
        "origin": "top_left"
      },
      "bbox": {
        "x0": 53.9,
        "y0": 311.53,
        "x1": 542.0,
        "y1": 534.8
      },
      "role": "interpretation",
      "object_kind": "list",
      "segment_order": 4,
      "source_text": "How do I interpret this requirement?\nQuarterly monitoring ensures the UoC can capture any seasonal or inter-annual variations in the data collected.\nMeasurements should be timed to coincide with, or immediately follow, annual turnover events when the waterbody is not permanently stratified (holomictic).\nThe UoC should calibrate equipment used to measure DO, TN, TP, SD and Chl-a according to the technical specifications of the equipment.\nThe UoC should conduct measurements of the parameters in-situ.\nSamples may be sent for laboratory analysis, however variability with sample maintenance during transit can lead to inconsistent results. This is particularly evident with DO and Chl-a samples."
    },
    {
      "segment_id": "p103-r2.6.10-evidence",
      "page_number": 103,
      "page_index": 102,
      "page_size": {
        "width": 595.32,
        "height": 841.92,
        "unit": "pdf_point",
        "origin": "top_left"
      },
      "bbox": {
        "x0": 53.9,
        "y0": 561.9,
        "x1": 526.6,
        "y1": 658.3
      },
      "role": "evidence_example",
      "object_kind": "list",
      "segment_order": 5,
      "source_text": "Evidence of implementation should be maintained, e.g.:\nDocumentation outlining the sampling plan to conduct quarterly monitoring and that is in accordance with Appendix 8 (8.8).\nQuarterly monitoring data has been collected and submitted to the ASC Water Quality Calculator. Data should be submitted at least annually."
    },
    {
      "segment_id": "p103-r2.6.10-footnote-13",
      "page_number": 103,
      "page_index": 102,
      "page_size": {
        "width": 595.32,
        "height": 841.92,
        "unit": "pdf_point",
        "origin": "top_left"
      },
      "bbox": {
        "x0": 51.0,
        "y0": 734.8,
        "x1": 522.0,
        "y1": 756.7
      },
      "role": "footnote",
      "object_kind": "footnote",
      "segment_order": 6,
      "source_text": "13 An exemption applies if the mean of Secchi Disk (SD) depth calculated over any rolling two-year period remains ≥10m."
    },
    {
      "segment_id": "p103-footer",
      "page_number": 103,
      "page_index": 102,
      "page_size": {
        "width": 595.32,
        "height": 841.92,
        "unit": "pdf_point",
        "origin": "top_left"
      },
      "bbox": {
        "x0": 59.1,
        "y0": 772.3,
        "x1": 538.5,
        "y1": 788.3
      },
      "role": "footer",
      "object_kind": "text_block",
      "segment_order": 7,
      "source_text": "Document Name ASC Farm Standard - Interpretation Manual Document ID ASC-INT-001 Version 1.0 Page 103 of 511"
    },
    {
      "segment_id": "p104-header",
      "page_number": 104,
      "page_index": 103,
      "page_size": {
        "width": 595.32,
        "height": 841.92,
        "unit": "pdf_point",
        "origin": "top_left"
      },
      "bbox": {
        "x0": 394.39,
        "y0": 35.28,
        "x1": 543.37,
        "y1": 44.5
      },
      "role": "header",
      "object_kind": "text_block",
      "segment_order": 8,
      "source_text": "Aquaculture Stewardship Council"
    },
    {
      "segment_id": "p104-r2.6.10-evidence-continuation",
      "page_number": 104,
      "page_index": 103,
      "page_size": {
        "width": 595.32,
        "height": 841.92,
        "unit": "pdf_point",
        "origin": "top_left"
      },
      "bbox": {
        "x0": 53.9,
        "y0": 71.0,
        "x1": 536.8,
        "y1": 142.3
      },
      "role": "evidence_example",
      "object_kind": "list",
      "segment_order": 9,
      "source_text": "Evidence that quarterly monitoring data has been timed with annual turnover events (where applicable).\nThat equipment to measure DO, TN, TP, SD and Chl-a has been calibrated according to technical specifications.",
      "continues_segment_id": "p103-r2.6.10-evidence"
    },
    {
      "segment_id": "p104-r2.6.10-auditor-guidance",
      "page_number": 104,
      "page_index": 103,
      "page_size": {
        "width": 595.32,
        "height": 841.92,
        "unit": "pdf_point",
        "origin": "top_left"
      },
      "bbox": {
        "x0": 53.9,
        "y0": 167.5,
        "x1": 544.2,
        "y1": 300.0
      },
      "role": "auditor_guidance",
      "object_kind": "list",
      "segment_order": 10,
      "source_text": "Auditors should confirm:\nThe sampling methodology to conduct quarterly monitoring is in accordance with Appendix 8 (8.8).\nThe UoC has conducted quarterly monitoring of the water quality parameters and submitted data to the ASC Water Quality Calculator at least annually.\nEvidence has been provided demonstrating the UoC has calibrated equipment to measure DO, TN, TP, SD and Chl-a in accordance with the technical specifications."
    },
    {
      "segment_id": "p104-r2.6.10-resources",
      "page_number": 104,
      "page_index": 103,
      "page_size": {
        "width": 595.32,
        "height": 841.92,
        "unit": "pdf_point",
        "origin": "top_left"
      },
      "bbox": {
        "x0": 53.9,
        "y0": 325.2,
        "x1": 536.1,
        "y1": 703.8
      },
      "role": "resource",
      "object_kind": "list",
      "segment_order": 11,